{
  "schema": "free-energy.project/v0",
  "id": "engine/luanti",
  "display_name": "Luanti",
  "kind": "ENGINE",
  "upstream": {
    "discovery_url": "https://github.com/luanti-org/luanti",
    "canonical_source_url": "https://github.com/luanti-org/luanti",
    "source_revision": "9a1b92d0d4d2c47fced18e6077722c6301eb04f5",
    "source_revision_reason": null,
    "contribution_url": "https://github.com/luanti-org/luanti/pulls",
    "issue_url": "https://github.com/luanti-org/luanti/issues",
    "read_only_mirror_urls": []
  },
  "play": {
    "status": "ENGINE_ONLY",
    "upstream_download_url": null,
    "content_requirements": [
      "Install an independently rights-checked game or content pack; engine alone does not ship a playable game."
    ],
    "local_test_evidence_id": null
  },
  "rights_claims": [
    {
      "claim_id": "code-lgpl",
      "claim_kind": "PUBLISHER_LICENSE",
      "component": "CODE",
      "scope_kind": "PROJECT_DEFAULT",
      "scope": "project",
      "statement": "Upstream LICENSE.txt identifies engine source code as LGPL-2.1-or-later; this does not license independently installed games.",
      "license_id": "LGPL-2.1-or-later",
      "exceptions_or_restrictions": [
        "Components may have separately stated exceptions"
      ],
      "evidence_ids": [
        "license-snapshot"
      ],
      "status": "OBSERVED_AT"
    },
    {
      "claim_id": "media-default",
      "claim_kind": "PUBLISHER_LICENSE",
      "component": "MEDIA",
      "scope_kind": "PROJECT_DEFAULT",
      "scope": "project media",
      "statement": "Upstream LICENSE.txt describes a CC BY-SA 3.0 media baseline with per-file exceptions; individual assets require scoped inspection.",
      "license_id": "CC-BY-SA-3.0",
      "exceptions_or_restrictions": [
        "Apache-2.0, CC BY-SA 4.0, CC BY 4.0 and font-specific exceptions are reported",
        "Do not infer one uniform license for every asset"
      ],
      "evidence_ids": [
        "license-snapshot"
      ],
      "status": "OBSERVED_AT"
    }
  ],
  "permission_decisions": [
    {
      "component": "CODE",
      "scope": "project",
      "use": "BUNDLE",
      "decision": "REVIEW_REQUIRED",
      "review_evidence_ids": [],
      "decision_reason": "No independently authenticated, use-and-scope-specific FREE ENERGY clearance; upstream license/policy evidence is not redistribution authorization.",
      "decided_at": null,
      "reviewer": null
    },
    {
      "component": "CODE",
      "scope": "project",
      "use": "HOST",
      "decision": "REVIEW_REQUIRED",
      "review_evidence_ids": [],
      "decision_reason": "No independently authenticated, use-and-scope-specific FREE ENERGY clearance; upstream license/policy evidence is not redistribution authorization.",
      "decided_at": null,
      "reviewer": null
    },
    {
      "component": "CODE",
      "scope": "project",
      "use": "TRANSFORM",
      "decision": "REVIEW_REQUIRED",
      "review_evidence_ids": [],
      "decision_reason": "No independently authenticated, use-and-scope-specific FREE ENERGY clearance; upstream license/policy evidence is not redistribution authorization.",
      "decided_at": null,
      "reviewer": null
    },
    {
      "component": "CODE",
      "scope": "project",
      "use": "CROSS_GAME_REUSE",
      "decision": "REVIEW_REQUIRED",
      "review_evidence_ids": [],
      "decision_reason": "No independently authenticated, use-and-scope-specific FREE ENERGY clearance; upstream license/policy evidence is not redistribution authorization.",
      "decided_at": null,
      "reviewer": null
    },
    {
      "component": "MEDIA",
      "scope": "project media",
      "use": "BUNDLE",
      "decision": "REVIEW_REQUIRED",
      "review_evidence_ids": [],
      "decision_reason": "No independently authenticated, use-and-scope-specific FREE ENERGY clearance; upstream license/policy evidence is not redistribution authorization.",
      "decided_at": null,
      "reviewer": null
    },
    {
      "component": "MEDIA",
      "scope": "project media",
      "use": "HOST",
      "decision": "REVIEW_REQUIRED",
      "review_evidence_ids": [],
      "decision_reason": "No independently authenticated, use-and-scope-specific FREE ENERGY clearance; upstream license/policy evidence is not redistribution authorization.",
      "decided_at": null,
      "reviewer": null
    },
    {
      "component": "MEDIA",
      "scope": "project media",
      "use": "TRANSFORM",
      "decision": "REVIEW_REQUIRED",
      "review_evidence_ids": [],
      "decision_reason": "No independently authenticated, use-and-scope-specific FREE ENERGY clearance; upstream license/policy evidence is not redistribution authorization.",
      "decided_at": null,
      "reviewer": null
    },
    {
      "component": "MEDIA",
      "scope": "project media",
      "use": "CROSS_GAME_REUSE",
      "decision": "REVIEW_REQUIRED",
      "review_evidence_ids": [],
      "decision_reason": "No independently authenticated, use-and-scope-specific FREE ENERGY clearance; upstream license/policy evidence is not redistribution authorization.",
      "decided_at": null,
      "reviewer": null
    }
  ],
  "adapter": {
    "status": "NONE",
    "target_id": null,
    "test_evidence_id": null
  },
  "evidence": [
    {
      "evidence_id": "license-snapshot",
      "evidence_kind": "PINNED_REPOSITORY_FILE",
      "subject_scope": "Engine code and bundled media license manifest",
      "url": "https://github.com/luanti-org/luanti/blob/9a1b92d0d4d2c47fced18e6077722c6301eb04f5/LICENSE.txt",
      "observed_at": "2026-10-08T00:00:00Z",
      "reviewer": "FREE ENERGY research record (not an authorized rights reviewer)",
      "currentness": "PINNED_SNAPSHOT",
      "repository": "https://github.com/luanti-org/luanti",
      "commit": "9a1b92d0d4d2c47fced18e6077722c6301eb04f5",
      "path": "LICENSE.txt"
    },
    {
      "evidence_id": "engine-faq",
      "evidence_kind": "MUTABLE_UPSTREAM_PAGE",
      "subject_scope": "Luanti engine and content separation",
      "url": "https://docs.luanti.org/about/faq/",
      "observed_at": "2026-10-08T00:00:00Z",
      "reviewer": "FREE ENERGY research record (not an authorized rights reviewer)",
      "currentness": "OBSERVED_AT",
      "repository": null,
      "commit": null,
      "path": null
    }
  ],
  "review": {
    "reviewed_at": "2026-10-08T00:00:00Z",
    "reviewer": "FREE ENERGY initial schema pilot; metadata review only, not rights authorization",
    "record_status": "DRAFT",
    "supersedes_record_revision": null,
    "claim_history": []
  }
}
